not materially affect the,0.0005919359539543755
"additional information , contact",0.0005918787007921356
I was not sure,0.0005917815949385327
in the summer of,0.0005912595808122275
can be seen as,0.0005910968022137023
as if she were,0.0005908346725395254
the end of this,0.0005905214640637424
materially affect the overall,0.0005898720335861779
the form of the,0.0005896497566033641
a lot of people,0.0005882201114639026
affect the overall learning,0.0005879512461235799
the overall learning experience,0.0005877564731108618
I could not help,0.0005866288103369403
important to note that,0.0005865350723164102
get out of the,0.0005864261790470521
the fact that they,0.000586303814445402
other parts of the,0.0005852659605534255
as a way of,0.0005847506820932663
the eyes of the,0.0005837088990627048
for the use of,0.0005833187917317563
of the number of,0.0005832497511537611
find a way to,0.0005823449266681655
the right of the,0.0005822753247846582
an integral part of,0.0005815916546708523
for the treatment of,0.0005814855679290548
there is also a,0.0005811830242580026
I can not help,0.0005803000906873812
do not have any,0.0005795456960790435
a deep breath and,0.0005795249277750937
"is , of course",0.0005791505369984857
on the surface of,0.0005786616398973978
through the use of,0.0005785033517429698
we do not want,0.0005783141917853732
is said to be,0.0005777584993283387
that one of the,0.0005776765487235639
from the University of,0.0005768289774002083
anything to do with,0.0005736357103415528
it was hard to,0.0005734168011918119
the creation of the,0.0005729284653962362
the right to remove,0.0005728358499867305
Learning reserves the right,0.0005727864551016607
Cengage Learning reserves the,0.0005722509696430638
do not worry about,0.0005713220090204456
a lot of time,0.0005712961889668864
one side of the,0.0005699232356841528
"the door , and",0.0005697683153627977
the United States in,0.0005692406881813711
you 've got to,0.0005686855570298488
it 's not a,0.0005681309871838386
the shape of the,0.0005681135867129618
by the time the,0.000567963156835704
and the use of,0.0005679014132293668
one or more of,0.0005673558242715512
if I did not,0.0005668949924460711
as much as I,0.0005667821700381277
get out of here,0.0005661091647290526
something to do with,0.0005659256178265777
do not think so,0.0005656646107634251
the date of the,0.0005654030423947604
parts of the world,0.0005652481220734053
the last of the,0.0005650443681724927
in the nineteenth century,0.0005638482261260882
the effects of the,0.0005637786242425808
they do not have,0.0005627497512387989
to be one of,0.0005627244924907519
and she did not,0.0005623809735173124
as a form of,0.0005623630117409234
he would not have,0.0005620677650415293
it had to be,0.0005618157388665712
the point of view,0.0005618090032004254
that it is a,0.0005614463998395726
to the use of,0.0005610809899511591
I ' m not,0.0005607335418391344
the absence of a,0.0005602901104845312
is the result of,0.0005599247005961176
that they do not,0.0005599016870701192
at the very least,0.0005599005644590949
is the number of,0.0005587111580788363
is due to the,0.0005585899160882106
of the Holy Spirit,0.0005585006685117778
it 's hard to,0.0005584568866818297
"in fact , I",0.0005584052465747113
if you have a,0.0005579320660279637
it had not been,0.0005575711465836474
"of course , but",0.0005573000360212761
I do not even,0.000557209665833819
this part of the,0.0005570850560101203
and I could not,0.0005570502550683666
there can be no,0.0005559461671259557
right to remove additional,0.0005557081735888016
in charge of the,0.000555623416456466
"and , in the",0.0005555229427697901
but at the same,0.00055463776397712
"he said , and",0.0005545052958762512
in the living room,0.0005539563390853626
the strength of the,0.0005538951567845376
"for example , when",0.0005535449021449523
out of the house,0.0005530262558517201
"that , in the",0.0005529016460280215
of the University of,0.0005526675816294525
the turn of the,0.0005515528288823105
of the United Nations,0.000551302486623889
in a series of,0.0005510094851465436
as soon as they,0.0005505711055415497
"example , in the",0.0005499295333411553
is not going to,0.0005491145177375048
and some of the,0.0005490421093264367
"me , but I",0.0005485751031403228
when I was a,0.0005483651748787765
is referred to as,0.0005482792951354167
they were going to,0.0005479256726627584
at any time if,0.0005469551754322406
"in general , the",0.0005468765926605388
had nothing to do,0.0005467710672242534
be seen as a,0.0005463029384271153
I do not remember,0.0005458538940173905
it 's time to,0.0005457315294157405
a good deal of,0.0005455328272644372
I 'm so sorry,0.0005450321427475941
in line with the,0.0005448452280120461
if they do not,0.0005447688904623929
the size of a,0.0005446083570859163
at the sight of,0.0005445404391189453
take a look at,0.000544017302381616
second half of the,0.000543452629036387
in the next section,0.0005429626093242748
"however , there are",0.0005400281041067231
the end of his,0.0005399708509444832
the source of the,0.0005397496965726938
as if he was,0.0005389722884383577
I would not be,0.0005376448009021086
the success of the,0.0005373029658452056
is that it is,0.0005371037023883902
by the time I,0.0005368449405472863
any time if subsequent,0.0005367512025267562
time if subsequent rights,0.0005365373451266249
if subsequent rights restrictions,0.0005354798455417228
it is not possible,0.0005352261354502284
from the point of,0.0005351222939304795
do not want you,0.0005343403953520461
he 's going to,0.0005341708810873751
it is important that,0.0005338021033658885
to talk to you,0.0005337796511454023
did not have any,0.0005337263271217474
additional content at any,0.0005334967531672757
rights restrictions require it,0.000533454655253864
remove additional content at,0.0005328888592976107
to remove additional content,0.000532843393551126
to get back to,0.0005327844564723496
I 've got a,0.0005327333776707435
subsequent rights restrictions require,0.0005326065226249963
there is no need,0.0005314805437676112
it has to be,0.0005309501100586238
for a number of,0.0005303725266866152
content at any time,0.0005301844893400429
the performance of the,0.0005301407075100948
does not have a,0.0005297236575145629
in connection with the,0.0005290865757582658
it ' s a,0.0005290792787866077
to come up with,0.0005287975034195054
as well as for,0.0005284085186995813
I did not see,0.000528083522808043
a small number of,0.0005279544225402471
point of view of,0.0005279443190410283
"however , in the",0.0005276440205920248
is related to the,0.0005275918191793943
had no idea what,0.0005275514051825191
that he had not,0.0005273167794784379
"of course , I",0.0005269042199270032
for a few days,0.0005268256371553014
not want to go,0.0005264433881015231
he would not be,0.0005264012901881114
for the time being,0.000525971891471312
do not think that,0.0005253791528504753
the idea of the,0.0005251950446424881
the middle of a,0.0005247925885902723
can be used as,0.0005247392645666174
that he was a,0.0005244097782309818
with a view to,0.000524371048150643
in the words of,0.0005233455429799341
"each other , and",0.0005230907102774152
the only one who,0.0005226208975637406
Journal of the American,0.0005225080751557973
I have no idea,0.0005219591183649086
to the right of,0.0005215241065929877
do you think you,0.0005211738519534023
the application of the,0.0005207248075436775
have the right to,0.0005200630283448456
it was going to,0.0005197964082265715
in the use of,0.0005190448201457946
the result of a,0.000518567710460462
to the back of,0.0005185654652384134
part of this book,0.000518352169143794
if it is not,0.0005174063693558111
to the number of,0.0005168809873964331
he would have to,0.0005165958441962578
by the time he,0.0005158319073942135
to make sense of,0.0005157392919847078
as a way to,0.0005149658129889568
within the context of,0.0005139711796214163
the door to the,0.0005137719161646009
you know what I,0.0005129479196727558
can be contacted at,0.0005121295362360324
of his or her,0.0005115687920293886
to the rest of,0.0005114413756781291
this is one of,0.0005093050468988633
of the nature of,0.0005089727540356669
to be part of,0.0005088896808198678
with the use of,0.0005086657199205176
of the relationship between,0.0005079006605074489
I shook my head,0.0005078961700633517
a change in the,0.0005075026948993303
can also be used,0.0005073157801637824
be obtained by contacting,0.0005072203582267158
By a News Reporter,0.0005069290406659069
Staff News Editor at,0.0005069178145556638
not need to be,0.0005060545266779678
the fact that she,0.0005059838021834361
the body of the,0.0005059136389944166
more information on this,0.0005058721023865171
keep in mind that,0.0005058659280258833
to participate in the,0.0005056060435737551
I 'll have to,0.0005045597700990963
you do not mind,0.0005043212152564299
an important part of,0.0005041612431854655
due to the fact,0.0005041584366579047
in front of them,0.0005041208291885902
it is in the,0.0005039872384766972
you will need to,0.0005039754510609419
the same time as,0.0005038205307395868
the image of the,0.0005035819758969205
the formation of the,0.0005035320197063387
to say that the,0.0005034786956826838
by means of a,0.0005034764504606351
the weight of the,0.0005029897985815959
as soon as she,0.0005028938153390172
I 'm not a,0.0005022432622504284
was the first to,0.0005018486644753828
over a period of,0.0005017425777335853
I can not tell,0.0005013288955711263
during the course of,0.0005005301578273283
no choice but to,0.0005002321046003734
came out of the,0.0005000856038617006
on the use of,0.000500029473310485
the mouth of the,0.0004999677297041478
the whole of the,0.0004999362965954671
he was trying to,0.0004996365594519759
or more of the,0.0004993177379210712
it was in the,0.000499065150440601
can be used in,0.0004989674832814858
he was in the,0.000498709282745894
whether or not the,0.0004982894262228014
not want you to,0.0004981440480951529
"of it , and",0.0004978993188918529
the back of my,0.0004975137020050018
on both sides of,0.0004974974241451492
I thought it was,0.0004974407322884215
there was not a,0.000497258869302483
be taken into account,0.0004966857763745716
did not mean to,0.0004966807246249622
the amount of the,0.0004966144905745278
I can not do,0.0004963422574011322
than that of the,0.0004963209277916702
"him , but he",0.0004960346619804707
out to be a,0.0004960099645379358
I was in the,0.0004953341527012999
under the influence of,0.0004948643399876253
to focus on the,0.0004948576043214795
is not to be,0.0004946993161670514
to the edge of,0.0004946426243103237
this does not mean,0.0004945163305700886
is a matter of,0.0004937501485459956
you want to be,0.0004936564105254656
I did not even,0.0004933796869079726
went back to the,0.0004933723899363146
is the fact that,0.0004929255907486384
he looked at her,0.0004921319047544498
but it 's not,0.0004920836324804044
do not even know,0.0004918102766959845
"In contrast , the",0.0004917238356471124
middle of the night,0.0004914072593382564
the contents of the,0.0004913578644531867
end of the day,0.0004913348509271883
the midst of the,0.0004907965589410307
this means that the,0.000490485034381784
as long as I,0.0004898322360711466
at the other end,0.0004890986097667587
the height of the,0.0004889947682470098
similar to that of,0.000488941444223355
is shown in Fig,0.0004885249555333352
that we do not,0.000488329621215105
but it was a,0.0004881831204764322
one of the two,0.00048777056092499753
the people of the,0.00048772453387300075
the only thing that,0.0004875106764728693
the interests of the,0.0004873826988160977
of this book may,0.00048702851503792726
the question of the,0.00048700213367885596
in order to avoid,0.0004867153065621442
on the top of,0.0004863482127571942
a quote from the,0.0004863089213713433
a long time ago,0.00048603612689243544
to the other side,0.0004859777511191712
he or she is,0.0004849348454775853
as we shall see,0.00048477262818457224
a few minutes later,0.0004844998337056644
had a chance to,0.00048399016830062675
either side of the,0.00048392505686121665
information may be obtained,0.0004832385802198498
that it was the,0.0004825178639422415
a couple of days,0.0004822866060712332
and I 'm not,0.0004822130750491408
I want to know,0.00048184878777175153
that he would not,0.00048125212001232966
in this case the,0.0004803888321346337
if she did not,0.00048015196120850385
to be the most,0.00047944022581909
According to the news,0.00047939026962850816
that she was not,0.00047880426667381724
this book may be,0.000478781814453331
additional information may be,0.0004787666592045028
that I could not,0.00047871782562494523
the first part of,0.00047747284999898314
be seen in the,0.00047724720518309646
the need for a,0.0004772140881578792
information on this research,0.0004768879696553166
there will be no,0.0004768368908537104
that it is the,0.00047682341952141866
that additional information may,0.00047682117429937
"one hand , and",0.00047681724516078494
on this research see,0.00047678805727415283
report that additional information,0.00047668309314337966
that 's what you,0.0004766746735606973
it could not be,0.00047661180734333584
"for instance , in",0.0004765831807622159
and it is not,0.0004765377150157312
quote from the research,0.0004763367676423794
on the verge of,0.00047621889348482664
obtained a quote from,0.0004761526594343922
an understanding of the,0.00047599886172406146
if and only if,0.00047566600755535296
has to do with,0.00047566263972228
a portion of the,0.0004753449408023997
this is not to,0.0004751496064841694
for most of the,0.000474863901978482
in the opposite direction,0.000474615804942109
was the one who,0.0004729846511237836
do not think it,0.0004727842650559439
at the hands of,0.00047243906216596796
