I do not know,0.009865151497876062
at the same time,0.00970926292451253
the end of the,0.009139563649727728
at the end of,0.007870275075506635
in the United States,0.007685775637577487
on the other hand,0.0074969305723732275
in the case of,0.006531356552502587
the rest of the,0.006055740501137816
as well as the,0.005486167520093248
did not want to,0.005228375614914328
one of the most,0.004844934909533771
for the first time,0.004688293064172926
as a result of,0.004637509509266122
do not want to,0.004617759974820912
I do not think,0.004347262919374341
I do not want,0.004187711266238479
in the middle of,0.00395784655551137
"for example , the",0.0039174510817180375
in whole or in,0.003858117721250073
on the basis of,0.0038082204677469633
whole or in part,0.0038046331642187744
in the form of,0.0037591550690128693
May not be copied,0.0036035011213534193
I 'm going to,0.003594214321654798
is one of the,0.003542908191316177
"be copied , scanned",0.0035371716489819424
"or duplicated , in",0.003507796286308769
Due to electronic rights,0.0035073270349006065
"duplicated , in whole",0.003489376484621857
"scanned , or duplicated",0.0034786684593664566
in the context of,0.0034602812133992496
be suppressed from the,0.0034559086434595545
some third party content,0.0034557368839728347
may be suppressed from,0.0034536791379652706
content may be suppressed,0.003449989676833869
party content may be,0.0034343314982667648
third party content may,0.003427234351371064
of the United States,0.003408080923379764
"rights , some third",0.0033826930750649473
suppressed from the eBook,0.0033729639666227468
"electronic rights , some",0.0033668794148709754
from the eBook and,0.0033565137859779904
it is important to,0.003289514114824999
in front of the,0.003198120667419219
the middle of the,0.003162409849430341
to be able to,0.003049243361208029
if you do not,0.003010623296749646
at the time of,0.0030079958256472436
the top of the,0.0029906666405704507
the fact that the,0.0027760851563283255
I did not know,0.0026688095694560906
do not know what,0.0025672020456456077
the edge of the,0.002553970952113066
can be used to,0.0024775054248030756
the back of the,0.0024459679132970776
do not have to,0.0024387259495792404
was one of the,0.002392635470059573
the beginning of the,0.002389667286511292
on the other side,0.0022953219334170835
you do not have,0.0022809137822255507
the nature of the,0.0022522147926945252
Parallel Bible Halseth English,0.0022419221335181205
at the beginning of,0.002213539158990439
the other side of,0.002164250921968019
in terms of the,0.0021641055438403707
on the one hand,0.0021430245927203267
for a long time,0.002139880720546741
the side of the,0.0021337754004910198
in addition to the,0.002070742475392435
in the presence of,0.0020667038822324724
with respect to the,0.002040925365281195
but I do not,0.0020327516344131793
in the absence of,0.002024117071719683
in the first place,0.0020239952684235453
the bottom of the,0.002013244583949221
I did not want,0.0019990547806019165
not be able to,0.0019924880674152034
at the University of,0.0019899307595018204
"New York , NY",0.00197525767210855
the name of the,0.0019544332376075614
"for example , in",0.001922091375302644
it is possible to,0.0018859623847072094
a member of the,0.0018795550822859484
as part of the,0.0018763309434241243
in the face of,0.001834608543400055
was not going to,0.0018297571798584905
in the course of,0.0018183901819318188
by the end of,0.001817393864647742
if you want to,0.001797718983835649
in a way that,0.0017939150163797676
the size of the,0.001786674175272955
and I do not,0.0017847298129788464
for the purpose of,0.0017829819076139927
when it comes to,0.0017790078645879281
on the part of,0.0017607918168019287
I do not have,0.0017583972874870711
a great deal of,0.001757029947259459
other side of the,0.00173682238751633
at the top of,0.001736404776215286
in the midst of,0.001731699352106882
in the same way,0.0017278555319596377
the United States and,0.001717250786918474
the center of the,0.0017136045463115085
in accordance with the,0.001703072770986925
the time of the,0.0017028690170860124
"In addition , the",0.001701072839447113
a wide range of,0.0016957965676328466
you 're going to,0.0016886416062693937
"for example , a",0.0016786705751514542
for the sake of,0.001671226541449241
he was going to,0.0016469422197713229
the extent to which,0.001646906296218545
the use of the,0.0016434626869014676
"that is , the",0.0016260448155537542
he did not want,0.0016259617423379552
did not know what,0.001619000431376196
as shown in Figure,0.0015714690806068242
that there is a,0.0015509157566682072
in relation to the,0.0015481238230507432
but he did not,0.00153961499279197
the value of the,0.0015353316704287074
as well as a,0.0015141300386235501
I 'm not sure,0.0015049762683313097
for the rest of,0.0015009859474453926
a large number of,0.0014954279002640236
she did not want,0.0014844790749439084
in the name of,0.0014799207128796893
the role of the,0.0014796299566243924
I want you to,0.0014767409171533253
you do not know,0.001476674683102891
a result of the,0.0014689803071422562
do not know how,0.0014688270707374376
"in fact , the",0.0014643282070575072
to the fact that,0.0014604445342188996
the case of the,0.0014562712277360196
was going to be,0.001446278305703106
he did not know,0.0014374192208047474
in front of him,0.0014334940113582405
you do not want,0.001430905831641689
I was going to,0.0014305247051989351
"for example , if",0.0014287902711663729
nothing to do with,0.0014221696726504926
what do you think,0.001421667304217113
to do with the,0.0014206142950763084
in the direction of,0.0014192677231526462
why do not you,0.0014171252200127465
can be found in,0.0014116446329920551
is based on the,0.001405891251492456
the way in which,0.001400955692124068
I would like to,0.0013972162748020847
will be able to,0.0013874108288102311
did not have to,0.00138722054624161
as a function of,0.0013704358275116086
as one of the,0.0013654789385337588
"however , it is",0.0013615144377014008
in one of the,0.0013599983515130674
from time to time,0.00135715870692707
the head of the,0.0013567792644008526
but I did not,0.0013435846557266012
in the process of,0.0013419243140216435
a part of the,0.0013314374431380325
the development of the,0.0013158477438434113
not want to be,0.0013154525847628535
in front of her,0.0012990467472535573
it is difficult to,0.001297294351444606
we 're going to,0.0012872626993313536
I 'd like to,0.0012838443487623236
at the bottom of,0.0012835603281731727
the direction of the,0.001281191057606362
it is necessary to,0.0012788335744553067
for the most part,0.0012784541319290892
as a matter of,0.0012773214174055583
the ways in which,0.0012649143203648618
What do you mean,0.0012643608731298759
the course of the,0.0012609733943640144
the part of the,0.0012548703195303418
the two of them,0.001246786958849783
it is clear that,0.001246142580121828
in such a way,0.0012456183207734742
the first time in,0.001243757593000677
that there is no,0.001230317132512101
do not need to,0.001219401424217203
he shook his head,0.0012193357514722807
but it was not,0.0012159185235142748
are you going to,0.0012157579901377982
it can not be,0.001215160199767352
in the field of,0.001212418783645982
it would have been,0.0012106512325882027
what are you doing,0.0012066423886203843
she did not know,0.0012050999210729797
of one of the,0.001204737879017639
which of the following,0.0012016164590645394
do you want to,0.0011967948447151192
on the edge of,0.0011964176474109503
to go to the,0.0011912474623384812
the front of the,0.0011911099424880029
the surface of the,0.0011895315513878201
to the United States,0.0011879217271789568
she shook her head,0.0011832752401493292
took a deep breath,0.0011825814665363044
University of Chicago Press,0.001173078564215503
to the extent that,0.0011655402311872476
not know what to,0.0011587450666570868
are more likely to,0.0011579906720487491
the basis of the,0.0011543219792212974
to get out of,0.0011456093950616116
the history of the,0.0011423280030375474
the form of a,0.0011418121632718761
the power of the,0.001141653313811936
we do not have,0.0011378622563828341
by the fact that,0.0011292972955728453
did not seem to,0.001125374331348387
she was going to,0.0011196636090677115
as well as in,0.001118784043330163
I did not have,0.001118315914533025
turned out to be,0.0011150698847562268
we do not know,0.0011128252240131147
do not have a,0.0011089050663162171
in the development of,0.0011060092911790043
the length of the,0.001102839037646347
that he did not,0.0011025847662493404
"me , and I",0.0010950862859124481
with the help of,0.0010927265575393441
what 's going on,0.001083720971902313
but she did not,0.0010816980268365027
with the exception of,0.0010816301088695318
the context of the,0.0010779389638215938
per cent of the,0.0010727373456404438
did not have a,0.0010724050527772474
"of course , the",0.0010708985087826207
to take care of,0.0010645153424983826
it would be a,0.0010621870472339594
but I can not,0.0010564886736745514
I do not like,0.0010522452040026518
in the light of,0.0010456521094568672
in the history of,0.0010414642090306712
it would not be,0.0010409691375689496
it was not a,0.0010404729434962037
on top of the,0.0010354812535766
of the twentieth century,0.001029436554516192
as soon as the,0.001028800595370919
at the age of,0.0010241687022846076
not know how to,0.0010217433011665816
for the purposes of,0.0010184467538936891
of the fact that,0.0010064050667414062
one of the first,0.0010059487253600231
"other words , the",0.0010009289701648119
in an attempt to,0.0009975268974556342
with regard to the,0.0009971317383750764
"other hand , the",0.0009952064604683813
in the hands of,0.0009938688694329134
the back of his,0.0009935870940658111
should be able to,0.0009912150169714398
to the end of,0.0009862727219369061
would be able to,0.0009836009076990434
in spite of the,0.0009817340055656124
he did not have,0.0009809212351840106
the heart of the,0.00097983286379594
at the heart of,0.0009786928523007512
in the way of,0.0009752778695647938
United States of America,0.0009729585551885653
the presence of the,0.0009723113699330494
on the side of,0.0009721053708100881
of the world 's,0.0009708255942423724
going to have to,0.0009704506421602521
in and out of,0.0009700807418277413
as we have seen,0.0009680914750926603
in the sense that,0.0009637677387325226
could not help but,0.000963712169486819
that is to say,0.000962427341169494
at the expense of,0.0009623459518702314
to one of the,0.0009619917680920609
in a number of,0.0009591818726982078
of the most important,0.000956124441573494
out of the way,0.0009558353692347336
you want me to,0.0009537366479247822
I do not believe,0.0009528121777462613
the New York Times,0.0009524304899979952
I do not care,0.0009512680262823201
and I did not,0.0009502408371950745
the relationship between the,0.0009487129635909859
I 'm not going,0.000947281634534988
as well as to,0.0009449022604689586
most of the time,0.0009448298520578905
in a variety of,0.0009383714708350233
do not think I,0.0009348105486659056
"this case , the",0.0009332910946444992
as part of a,0.000932966660058473
University of California Press,0.0009327606609355118
"see , for example",0.0009321785871194059
what was going on,0.000932027595936636
the face of the,0.0009290465023615754
to ensure that the,0.0009272003685320942
"for instance , the",0.0009252694775702775
did not have the,0.0009252133470190618
at the back of,0.0009226268512190469
be found in the,0.0009173140945464902
that 's what I,0.0009123330694316177
it was as if,0.0009116667997886885
the results of the,0.0009099896189183663
the United States of,0.00090990205525847
in the back of,0.0009071819687465619
on the back of,0.0009064011927791528
the importance of the,0.0009059285735379174
and the United States,0.0009055154526809706
an important role in,0.0009046886496615648
as a means of,0.0009033257998780499
no part of this,0.0009024591441672811
the difference between the,0.0009003413384699164
would not have been,0.0008962550343414205
the quality of the,0.0008947237929042589
that can not be,0.0008940227223195761
that it would be,0.0008914008642722953
I do not see,0.0008895670791640816
as long as the,0.0008888098780281831
it is not a,0.0008885129474122525
it should be noted,0.0008846949473185673
I did not think,0.0008835083474658695
I can not believe,0.0008831086979412144
does not mean that,0.000881995629110609
in the center of,0.0008815050480929847
"him , and he",0.0008807781574547426
did not know how,0.0008805906814136825
the fact that he,0.0008800770868700597
do not know if,0.0008799839101550418
the base of the,0.0008783016775351102
the best way to,0.0008776544922795943
in contrast to the,0.0008772963793628388
in front of me,0.00087716391126197
I do not understand,0.0008757960097288457
but it is not,0.0008756899229870483
the presence of a,0.0008739392110946336
as if it were,0.0008731017432704968
the case of a,0.000872997901750748
over the course of,0.0008720128105769142
the majority of the,0.0008714200719560774
the members of the,0.0008659653049889452
I am going to,0.0008650442026434972
in an effort to,0.0008639025072317718
on behalf of the,0.0008635752661181849
would have to be,0.0008634287653795121
the total number of,0.0008621501114228207
that it is not,0.0008621141878700427
a wide variety of,0.0008604240969729409
it does not matter,0.0008602809640673412
one of the best,0.0008590881898540096
to go back to,0.0008535475431435175
you do not need,0.0008531899915322741
at the level of,0.0008525736780799269
to the development of,0.0008494483289882421
what do you want,0.0008482078438063773
it was time to,0.0008437252579862993
as soon as he,0.0008434305725924174
but there was no,0.0008423635308138088
as soon as I,0.000841554689570792
is going to be,0.0008404595825165756
the use of a,0.0008402159759242999
to look at the,0.0008355678049781359
despite the fact that,0.0008344513683144575
as far as the,0.000831931106564877
as soon as possible,0.0008310195464131356
going to be a,0.0008277269282788284
when it came to,0.0008276264545921525
and at the same,0.0008273957580266563
the Second World War,0.0008251561490331538
is likely to be,0.0008241822839695632
have been able to,0.0008239914400954301
in a state of,0.0008237012451456454
do not have the,0.0008227082956946414
the position of the,0.0008226605847261082
"a result , the",0.0008224399916598309
as if they were,0.0008222598125904287
that it was not,0.000822080756132051
and colleagues published their,0.0008197165373148498
published their study in,0.0008194802276942321
colleagues published their study,0.000819367966591801
there was no way,0.0008165434772546318
as if he were,0.0008157155516242017
the structure of the,0.0008132839761455418
the work of the,0.000813277801784908
to make sure that,0.0008102422615751683
the centre of the,0.0008084808848780227
that there was a,0.0008064983538090876
to deal with the,0.000804949150595537
this is not the,0.0008036020173663626
to be in the,0.0008034734784040789
not have to be,0.0008031136815707868
some of the most,0.0008017991040613175
it was not until,0.000800962758848205
such a way that,0.0008007039970071011
the start of the,0.0007995465850410353
the hands of the,0.0007987253950767511
this is not a,0.0007986524253601708
and the rest of,0.0007983313586072176
in the sense of,0.0007976875411847746
not going to be,0.0007967585805621564
it is easy to,0.0007957454241127147
the meaning of the,0.0007949421959248195
it is possible that,0.0007930534028764145
the level of the,0.0007927811697030188
of the nineteenth century,0.0007927188647911695
referred to as the,0.0007922473681609585
the purpose of the,0.0007921884310821821
all the way to,0.0007908688018231033
but I could not,0.0007893959361592058
I think it 's,0.0007880117567662291
that he was not,0.0007799452352510349
it was not the,0.0007797594431265113
the back of her,0.0007786239220754196
the way to the,0.0007784190455634827
there would be no,0.0007780968561995051
that there was no,0.0007755210252042211
the end of a,0.0007724377740259481
the development of a,0.0007697092679313577
in the area of,0.0007674881820197563
in order to be,0.0007661135448204863
that I did not,0.0007660557303527342
the only way to,0.0007619885106116516
at a time when,0.0007577214661082416
know what to do,0.0007568722108683495
and he did not,0.0007560061164630928
a copy of the,0.0007537025186412044
I would not have,0.0007503717317320706
will not be able,0.0007500809754767738
she did not have,0.0007493630657267262
in response to the,0.0007441114913549946
in the wake of,0.0007428872840329823
the vast majority of,0.0007412628658808027
in the event of,0.000740372074033011
from the perspective of,0.0007392331851488465
it is impossible to,0.0007391327114621706
should be noted that,0.000739061986967639
out of the room,0.0007388806852872125
"the world , and",0.0007387656176572206
the life of the,0.0007372175370546942
in the number of,0.0007361824896902785
of some of the,0.0007354050815559424
it is not the,0.0007346686487239937
"in particular , the",0.0007342173590922203
that you do not,0.000733255842749897
if there is a,0.0007320742946468087
more likely to be,0.0007306676630333456
and one of the,0.0007294047256309945
is part of the,0.0007285869034997833
a bit of a,0.0007266846391190865
there has been a,0.0007247369089919051
but he could not,0.0007246398031383021
the sound of the,0.0007222800747651982
a function of the,0.0007208341517658843
the effect of the,0.0007191827909491213
in the eyes of,0.0007181561631673879
to get rid of,0.0007176296585969856
it is true that,0.0007171867885478945
if he did not,0.0007155023107059143
you are going to,0.0007136359698779955
for more information on,0.0007113043067804994
for a few minutes,0.0007109523682243776
is shown in Figure,0.000709820776311871
in any form or,0.0007092566642721542
but it did not,0.0007091023052563113
and there was a,0.0007075418759325175
that can be used,0.0007056867612148419
may or may not,0.0007050283498490829
it will not be,0.0007044838835022915
"same time , the",0.000704348608873862
it 's going to,0.0007042907944061099
an increase in the,0.0007030531157518059
it had been a,0.0007028319613800164
we are going to,0.0007025485020963776
on either side of,0.0007023200507529301
how do you know,0.0007012333632813961
"in fact , it",0.0007000478860397225
as far as I,0.0006994500956692763
that I do not,0.0006991004023352032
for the development of,0.0006980142761691812
form or by any,0.0006971526722080217
any form or by,0.0006964712473162643
can be seen in,0.0006962085563365754
at the edge of,0.0006939846638974132
do not you think,0.0006931438282402034
one of the few,0.0006922154289230974
that he could not,0.0006918752777827308
the other end of,0.0006912954491886736
in the treatment of,0.0006912196729445326
the sum of the,0.0006906729613756926
the light of the,0.0006903440363455692
not been able to,0.0006902648922683552
and I can not,0.000689580660849037
I do not need,0.0006876536990258054
would not be able,0.0006875790453926886
that 's why I,0.0006854477683630322
in front of a,0.0006849543808178471
the second half of,0.0006838014592958786
up and down the,0.0006836931273320325
did not need to,0.0006830914078230012
the existence of a,0.0006811380646406983
do not know why,0.0006807030528687773
at the start of,0.0006782260116436329
as in the case,0.0006776978231566941
the same as the,0.0006772830183832107
to the point of,0.0006771915255847293
and there is no,0.0006757214664483927
that she did not,0.0006749126252053758
that it was a,0.0006746420759485166
to the top of,0.0006741896637057189
an example of a,0.0006739505475575404
both sides of the,0.0006738540030094496
is the same as,0.0006729312167474651
of a number of,0.0006726640353236789
could not have been,0.0006719141311594384
"to him , and",0.0006710081840628185
I was able to,0.0006709183751808736
review has deemed that,0.0006705726109853855
has deemed that any,0.0006700943786890286
deemed that any suppressed,0.0006696043589769164
in New York City,0.0006691547532616794
the manner in which,0.0006687421937102447
the rest of his,0.0006686782048818589
go back to the,0.0006686697852991766
to be found in,0.0006663021986489025
and the fact that,0.0006654927961003735
that any suppressed content,0.0006639559416080904
that he had been,0.0006639520124695052
any suppressed content does,0.0006638846558080465
suppressed content does not,0.0006636505914094775
does not have to,0.0006634170883164205
content does not materially,0.0006628681315255319
was the first time,0.000662191758383384
the result of the,0.0006621575187471424
Editorial review has deemed,0.0006608519221258675
does not seem to,0.0006602704096152739
for each of the,0.000660069462241922
over and over again,0.0006590052269908742
the fact that it,0.0006586465527686065
the idea of a,0.0006570911751944222
the impact of the,0.0006569065056809229
the degree to which,0.0006567903154399066
all over the world,0.0006565820710948966
a few of the,0.000656051076080397
are a number of,0.0006550861919050008
as shown in Fig,0.0006550384809364677
I had no idea,0.000654791506511119
you 'll have to,0.0006538928563861572
as long as you,0.0006537727370065558
if I do not,0.0006534275341165798
be one of the,0.0006525097996042047
it was the first,0.0006518384782116661
and it was not,0.0006508157795685178
all of a sudden,0.000649963717801065
"her , and she",0.0006488826433846526
to that of the,0.0006487574722554417
the creation of a,0.0006486592437908145
in order to make,0.000647758348443804
is an example of,0.000647179081155259
might be able to,0.0006470247221394161
as if he had,0.0006460845354065547
but she could not,0.0006457645912646259
he was able to,0.0006432521877922155
I will not be,0.0006419987925835711
"this chapter , we",0.0006414975467612157
the remainder of the,0.0006404237693164613
the foot of the,0.0006398905290799131
the location of the,0.000639796791059383
in the Middle East,0.0006393887219520456
I 'll tell you,0.000639296667848052
you will not be,0.0006390390286179723
at the foot of,0.0006381128745229149
page intentionally left blank,0.0006372507092562433
on one of the,0.0006371889656499061
for as long as,0.000637152480791616
This page intentionally left,0.0006363997700998148
out of the car,0.0006356683890174755
but I 'm not,0.0006356038388835775
a matter of fact,0.0006351996989148252
at the head of,0.0006347394283948573
if we do not,0.0006345906824341359
"and , of course",0.0006340086086180301
are likely to be,0.0006331688955718447
in the long run,0.0006330426018316096
or by any means,0.0006327720525747504
it is likely that,0.000632306730305173
he was about to,0.0006322494771429331
the door of the,0.0006319845409411955
not seem to be,0.0006318588085064725
to get to the,0.0006316331636905859
there are a number,0.0006309893462681428
but he was not,0.0006301103418361065
the state of the,0.000628133423822293
be used as a,0.0006271225125949
can be used for,0.0006270068836593959
may be able to,0.0006268177237017993
other end of the,0.0006267312826529273
in a position to,0.0006258444199437208
for the benefit of,0.0006249670994282209
it is hard to,0.0006244798862436695
I want to be,0.0006241161602717923
and there was no,0.0006220707629854958
with the rest of,0.0006211064401156118
the terms of the,0.0006210867944226863
the influence of the,0.0006209010022981627
to return to the,0.0006206691831216422
if you can not,0.0006203178058710326
to take advantage of,0.0006196335744517144
was supposed to be,0.000619599896120985
"however , there is",0.0006194696732421648
for a couple of,0.0006194449757996299
the same way as,0.0006193220498924678
it seems to me,0.0006187584991582632
reserves the right to,0.0006186793550810492
the story of the,0.0006184890725124283
in the United Kingdom,0.0006183279778304395
in view of the,0.0006180686546838234
from the fact that,0.0006172485873305635
and the number of,0.000617207050722664
at the center of,0.0006171453071163268
would you like to,0.0006155169598255621
the corner of the,0.0006145936122580655
has been shown to,0.0006144706863509033
it is to be,0.0006126840509057107
and out of the,0.0006119436889351769
is important to note,0.0006114065195600436
as a consequence of,0.0006106756997832165
I did not mean,0.0006088868191159752
I 've got to,0.0006076317399907943
did not say anything,0.0006063373694797625
he had not been,0.0006062430701537203
the needs of the,0.0006061678552150915
it was one of,0.0006052546111468136
seems to have been,0.0006046933056346576
the rest of us,0.000603662187408827
the first half of,0.0006030677648714537
the First World War,0.0006027141423987954
it must have been,0.0006027107745657225
"said , ' I",0.0006024660453624224
rest of the world,0.0006009449074244797
"to me , and",0.0006006361893927939
but it does not,0.0005995697089196975
why did not you,0.0005986901431821489
in light of the,0.0005986109991049349
as much as possible,0.0005973082090112208
the purpose of this,0.0005970443954205075
one of the main,0.000596783949662867
does not want to,0.0005962860716735847
the scope of the,0.0005956888426086506
it did not matter,0.000595434571211644
does not materially affect,0.0005947632498191054
it was too late,0.0005943400254629398
at the base of,0.0005941458137557338
the first time I,0.0005938848066925813
I 'm sure you,0.0005933044167930119
on the way to,0.0005928340427738252
